### ISSUE TITLE
QUIC fair-queue scheduling volatility?

### ISSUE THREAD

**Issue by j3knk** [lxin/quic#55]
I have been working on a measurement tool similar to iperf3, developed for comparing TCP and QUIC in specific use cases. Part of the use case is setting a fair-queue maximum rate via the `SO_MAX_PACING_RATE` socket option. This works fine with TCP so far, but when I implemented QUIC usage, the measured rates with QUIC were quite volatile (Example with maximum rate 700 kbit/s and 6s duration):
```
0.00-1.00 sec 130.13 KB 1.07 Mbits/s
1.00-2.00 sec 63.63 KB 521.28 Kbits/s
2.00-3.00 sec 63.63 KB 521.28 Kbits/s
3.00-4.00 sec 128.68 KB 1.05 Mbits/s
4.00-5.00 sec 0.00 B 0.00 bits/s
5.00-6.00 sec 127.27 KB 1.04 Mbits/s

Receiver        0.00-6.00 sec 514.72 KB 702.76 Kbits/s
```
Overall the rate limiting approximately works, but the TCP rate limiting manages to deliver smoother results.
So I was curious whether this could be an implementation error from my side and decided to test this with the original [iperf3](https://github.com/lxin/iperf) tool supporting QUIC (Client `iperf3 -c localhost --quic -l 1448 --fq-rate 700K -t 6`):
```
iperf3 -s --pkey ../varas/keys/server-key.pem --cert ../varas/keys/server-cert.pem -1
-----------------------------------------------------------
Server listening on 5201 (test #1)
-----------------------------------------------------------
Accepted connection from ::1, port 45816
[  5] local ::1 port 5201 connected to ::1 port 59563
[ ID] Interval           Transfer     Bitrate
[  5]   0.00-1.05   sec   127 KBytes   988 Kbits/sec
[  5]   1.05-3.06   sec   127 KBytes   520 Kbits/sec
[  5]   3.06-4.61   sec   129 KBytes   678 Kbits/sec
[  5]   4.61-5.04   sec  63.6 KBytes  1.23 Mbits/sec
[  5]   5.04-6.09   sec  63.6 KBytes   493 Kbits/sec
- - - - - - - - - - - - - - - - - - - - - - - - -
[ ID] Interval           Transfer     Bitrate
[  5]   0.00-6.09   sec   510 KBytes   686 Kbits/sec                  receiver
```
The results with iperf3 showed similar volatility in rate limiting. Additionally, osme of the iperf3 measurements intervals often got noticeable delayed.
I tried to find an explanation for this and added a print a the end of [`quic_cong_update_pacing_time`](https://github.com/lxin/quic/blob/main/modules/net/quic/cong.c#L567), the function responsible for calculating the delays according to targeted rate:
`pr_info("%s: update pacing time: wait %lluns, rate: %lluB/s\n",
                __func__, cong->pacing_time - ktime_get_ns(), rate);`
With this I got the following prints:
```
# own tool
[ 9505.767171] quic_cong_update_pacing_time: update pacing time: wait 106434ns, rate: 788894B/s
[ 9505.769599] quic_cong_update_pacing_time: update pacing time: wait 24672ns, rate: 788894B/s
[ 9505.773244] quic_cong_update_pacing_time: update pacing time: wait 798ns, rate: 132486000B/s
[ 9505.810529] quic_cong_update_pacing_time: update pacing time: wait 12034ns, rate: 60140800B/s
[ 9505.818630] quic_cong_update_pacing_time: update pacing time: wait 544337ns, rate: 60140800B/s
[ 9505.821152] quic_cong_update_pacing_time: update pacing time: wait 18446744073709551572ns, rate: 141561600B/s
[ 9505.821471] quic_cong_update_pacing_time: update pacing time: wait 10799109ns, rate: 87500B/s
[ 9505.842468] quic_cong_update_pacing_time: update pacing time: wait 738123825ns, rate: 87500B/s
[ 9505.844117] quic_cong_update_pacing_time: update pacing time: wait 18446744073709551595ns, rate: 161853658B/s
[ 9507.397379] quic_cong_update_pacing_time: update pacing time: wait 374159953ns, rate: 87500B/s
[ 9507.949810] quic_cong_update_pacing_time: update pacing time: wait 570049191ns, rate: 87500B/s
[ 9507.956291] quic_cong_update_pacing_time: update pacing time: wait 18446744073709551574ns, rate: 184990940B/s
[ 9508.944217] quic_cong_update_pacing_time: update pacing time: wait 374159930ns, rate: 87500B/s
[ 9508.947071] quic_cong_update_pacing_time: update pacing time: wait 18446744073709551565ns, rate: 192372463B/s
[ 9509.957179] quic_cong_update_pacing_time: update pacing time: wait 374159925ns, rate: 87500B/s
[ 9509.961934] quic_cong_update_pacing_time: update pacing time: wait 18446744073709551581ns, rate: 199312312B/s
[ 9510.928708] quic_cong_update_pacing_time: update pacing time: wait 374159905ns, rate: 87500B/s
[ 9511.774081] quic_cong_update_pacing_time: update pacing time: wait 374159908ns, rate: 87500B/s
[ 9511.782762] quic_cong_update_pacing_time: update pacing time: wait 18446744073709551586ns, rate: 227893562B/s
[ 9512.419599] quic_cong_update_pacing_time: update pacing time: wait 476964153ns, rate: 87500B/s
[ 9512.431835] quic_cong_update_pacing_time: update pacing time: wait 1213047652ns, rate: 87500B/s
[ 9512.433426] quic_cong_update_pacing_time: update pacing time: wait 1959775925ns, rate: 87500B/s
[ 9512.435892] quic_cong_update_pacing_time: update pacing time: wait 2705629871ns, rate: 87500B/s
[ 9512.436348] quic_cong_update_pacing_time: update pacing time: wait 3453493842ns, rate: 87500B/s
[ 9512.436558] quic_cong_update_pacing_time: update pacing time: wait 4201603397ns, rate: 87500B/s
[ 9512.436837] quic_cong_update_pacing_time: update pacing time: wait 4949644742ns, rate: 87500B/s
[ 9512.437804] quic_cong_update_pacing_time: update pacing time: wait 5696997519ns, rate: 87500B/s
[ 9512.438471] quic_cong_update_pacing_time: update pacing time: wait 6444650191ns, rate: 87500B/s
[ 9512.439208] quic_cong_update_pacing_time: update pacing time: wait 7192234017ns, rate: 87500B/s
iperf3 with QUIC:
[ 9541.268098] quic_cong_update_pacing_time: update pacing time: wait 959945ns, rate: 87500B/s
[ 9541.268645] quic_cong_update_pacing_time: update pacing time: wait 857820ns, rate: 87500B/s
[ 9541.269375] quic_cong_update_pacing_time: update pacing time: wait 1250ns, rate: 88298666B/s
[ 9541.270365] quic_cong_update_pacing_time: update pacing time: wait 228534ns, rate: 87500B/s
[ 9541.278691] quic_cong_update_pacing_time: update pacing time: wait 740005510ns, rate: 87500B/s
[ 9542.033307] quic_cong_update_pacing_time: update pacing time: wait 733497762ns, rate: 87500B/s
[ 9542.037189] quic_cong_update_pacing_time: update pacing time: wait 18446744073709551586ns, rate: 101086476B/s
[ 9543.242590] quic_cong_update_pacing_time: update pacing time: wait 374051344ns, rate: 87500B/s
[ 9543.251478] quic_cong_update_pacing_time: update pacing time: wait 28523ns, rate: 87500B/s
[ 9544.269064] quic_cong_update_pacing_time: update pacing time: wait 374051350ns, rate: 87500B/s
[ 9544.273379] quic_cong_update_pacing_time: update pacing time: wait 34238ns, rate: 87500B/s
[ 9544.824379] quic_cong_update_pacing_time: update pacing time: wait 566840245ns, rate: 87500B/s
[ 9545.558271] quic_cong_update_pacing_time: update pacing time: wait 581052734ns, rate: 87500B/s
[ 9545.559768] quic_cong_update_pacing_time: update pacing time: wait 62781ns, rate: 87500B/s
[ 9546.162903] quic_cong_update_pacing_time: update pacing time: wait 724528488ns, rate: 87500B/s
[ 9546.901200] quic_cong_update_pacing_time: update pacing time: wait 734335832ns, rate: 87500B/s
[ 9546.908016] quic_cong_update_pacing_time: update pacing time: wait 34234ns, rate: 87500B/s
[ 9547.366574] quic_cong_update_pacing_time: update pacing time: wait 1017062921ns, rate: 87500B/s
[ 9547.369243] quic_cong_update_pacing_time: update pacing time: wait 1762497259ns, rate: 87500B/s
[ 9547.369692] quic_cong_update_pacing_time: update pacing time: wait 2510150528ns, rate: 87500B/s
[ 9547.374114] quic_cong_update_pacing_time: update pacing time: wait 3253832456ns, rate: 87500B/s
[ 9547.374599] quic_cong_update_pacing_time: update pacing time: wait 4001449846ns, rate: 87500B/s
[ 9547.376362] quic_cong_update_pacing_time: update pacing time: wait 4747790055ns, rate: 87500B/s
[ 9547.376815] quic_cong_update_pacing_time: update pacing time: wait 5495439490ns, rate: 87500B/s
[ 9547.380474] quic_cong_update_pacing_time: update pacing time: wait 6239883250ns, rate: 87500B/s
[ 9547.382910] quic_cong_update_pacing_time: update pacing time: wait 6985550798ns, rate: 87500B/s
[ 9547.384722] quic_cong_update_pacing_time: update pacing time: wait 7731935696ns, rate: 87500B/s
```
In some prints, the desired rate differs from the targeted 87500B/s (= 700kbit/s). To me, this looks like a possible explanation for the volatility, but I cannot exclude that this is related to my setup. I can test this currently only on a localhost connection running inside a virtual machine. I would appreciate it if someone has some ideas to further anylayze rate limiting the behavior or knows whether this is intended behavior.
VM-Kernel: `6.8.0-84-generic #84-Ubuntu SMP PREEMPT_DYNAMIC Fri Sep  5 22:36:38 UTC 2025 x86_64 x86_64 x86_64 GNU/Linux`

**Comment by lxin** [comment]
@j3knk, just back from a trip, thanks for your patience.

This is the packet size observed when running the **TCP** iperf3 test with `--fq-rate 700k`:

```
18:39:26.771529 IP6 ::1.40104 > ::1.5201: Flags [P.], length 50176
18:39:27.344975 IP6 ::1.40104 > ::1.5201: Flags [.], length 44544
18:39:27.344997 IP6 ::1.40104 > ::1.5201: Flags [P.], length 22016
18:39:28.105663 IP6 ::1.40104 > ::1.5201: Flags [P.], length 62464
18:39:28.819542 IP6 ::1.40104 > ::1.5201: Flags [P.], length 54272
18:39:29.439797 IP6 ::1.40104 > ::1.5201: Flags [.], length 44544
18:39:29.439811 IP6 ::1.40104 > ::1.5201: Flags [P.], length 30208
```

And this is the packet size when running the **QUIC** iperf3 test with `--fq-rate 700k`:

```
18:42:32.548484 IP6 ::1.44075 > ::1.5201: UDP, length 65488
18:42:32.548541 IP6 ::1.44075 > ::1.5201: UDP, length 65488
18:42:32.548597 IP6 ::1.44075 > ::1.5201: UDP, length 65488
18:42:32.548656 IP6 ::1.44075 > ::1.5201: UDP, length 65488
18:42:32.548714 IP6 ::1.44075 > ::1.5201: UDP, length 65488
18:42:32.548770 IP6 ::1.44075 > ::1.5201: UDP, length 65488
18:42:32.548830 IP6 ::1.44075 > ::1.5201: UDP, length 65488
18:42:32.548887 IP6 ::1.44075 > ::1.5201: UDP, length 65488
```

QUIC tends to bundle user data into packets that are closer to the MTU (65536 for the loopback interface by default), which can lead to less smooth throughput compared to TCP. In contrast, TCP bundles user data more gradually/slowly, resulting in smoother delivery.

I think you can achieve smoother results with QUIC by reducing the loopback MTU. For example: Setting the MTU to 1500 (`ip link set lo mtu 1500`) produces smoother QUIC results. On my host, QUIC achieves throughput comparable to TCP even with mtu=32768 (`ip link set lo mtu 32768`).

Thanks.
